{
  "$schema": "https://json-schema.org/draft/2020-12/schema",
  "type": "object",
  "properties": {
    "approvalId": {
      "anyOf": [
        {
          "type": "string",
          "minLength": 1,
          "maxLength": 256
        },
        {
          "type": "null"
        }
      ]
    },
    "specId": {
      "anyOf": [
        {
          "type": "string",
          "minLength": 1,
          "maxLength": 256
        },
        {
          "type": "null"
        }
      ]
    },
    "manifestDigest": {
      "anyOf": [
        {
          "type": "string",
          "pattern": "^[a-f0-9]{64}$"
        },
        {
          "type": "null"
        }
      ]
    },
    "executionFingerprint": {
      "type": "string",
      "pattern": "^[a-f0-9]{64}$"
    },
    "environmentFingerprint": {
      "type": "string",
      "pattern": "^[a-f0-9]{64}$"
    },
    "mode": {
      "type": "string",
      "enum": [
        "not-adopted",
        "information-flow",
        "adapter-default"
      ]
    },
    "checks": {
      "maxItems": 512,
      "type": "array",
      "items": {
        "type": "object",
        "properties": {
          "id": {
            "type": "string",
            "minLength": 1,
            "maxLength": 256
          },
          "status": {
            "type": "string",
            "enum": [
              "passed",
              "failed",
              "unavailable"
            ]
          },
          "inputDigest": {
            "anyOf": [
              {
                "type": "string",
                "pattern": "^[a-f0-9]{64}$"
              },
              {
                "type": "null"
              }
            ]
          },
          "observationDigest": {
            "anyOf": [
              {
                "type": "string",
                "pattern": "^[a-f0-9]{64}$"
              },
              {
                "type": "null"
              }
            ]
          },
          "executionId": {
            "anyOf": [
              {
                "type": "string",
                "minLength": 1,
                "maxLength": 256
              },
              {
                "type": "null"
              }
            ]
          },
          "reusedFrom": {
            "anyOf": [
              {
                "type": "string",
                "minLength": 1,
                "maxLength": 256
              },
              {
                "type": "null"
              }
            ]
          },
          "trustTier": {
            "type": "string",
            "enum": [
              "component-closed-input",
              "hardened-argv",
              "host-allowlist"
            ]
          },
          "moduleDigest": {
            "anyOf": [
              {
                "type": "string",
                "pattern": "^[a-f0-9]{64}$"
              },
              {
                "type": "null"
              }
            ]
          },
          "runtimeDigest": {
            "anyOf": [
              {
                "type": "string",
                "pattern": "^[a-f0-9]{64}$"
              },
              {
                "type": "null"
              }
            ]
          },
          "recordedAt": {
            "type": "string",
            "pattern": "^\\d{4}-\\d{2}-\\d{2}T\\d{2}:\\d{2}:\\d{2}\\.\\d{3}Z$"
          }
        },
        "required": [
          "id",
          "status",
          "inputDigest",
          "observationDigest",
          "executionId",
          "reusedFrom",
          "trustTier",
          "moduleDigest",
          "runtimeDigest",
          "recordedAt"
        ],
        "additionalProperties": false
      }
    },
    "acceptance": {
      "maxItems": 256,
      "type": "array",
      "items": {
        "type": "object",
        "properties": {
          "id": {
            "type": "string",
            "minLength": 1,
            "maxLength": 256
          },
          "status": {
            "type": "string",
            "enum": [
              "passed",
              "failed",
              "unknown"
            ]
          },
          "evidenceDigest": {
            "anyOf": [
              {
                "type": "string",
                "pattern": "^[a-f0-9]{64}$"
              },
              {
                "type": "null"
              }
            ]
          },
          "recordedAt": {
            "type": "string",
            "pattern": "^\\d{4}-\\d{2}-\\d{2}T\\d{2}:\\d{2}:\\d{2}\\.\\d{3}Z$"
          }
        },
        "required": [
          "id",
          "status",
          "evidenceDigest",
          "recordedAt"
        ],
        "additionalProperties": false
      }
    },
    "policyDigest": {
      "anyOf": [
        {
          "type": "string",
          "pattern": "^[a-f0-9]{64}$"
        },
        {
          "type": "null"
        }
      ]
    },
    "modelDigest": {
      "anyOf": [
        {
          "type": "string",
          "pattern": "^[a-f0-9]{64}$"
        },
        {
          "type": "null"
        }
      ]
    },
    "sourceScope": {
      "type": "string",
      "enum": [
        "whole-working-product",
        "declared-component-inputs"
      ]
    }
  },
  "required": [
    "approvalId",
    "specId",
    "manifestDigest",
    "executionFingerprint",
    "environmentFingerprint",
    "mode",
    "checks",
    "acceptance",
    "policyDigest",
    "modelDigest",
    "sourceScope"
  ],
  "additionalProperties": false
}
