{"acceptance":[{"evidenceDigest":"76e02bf96bdb79bb61bb3bdeb612038c04fdf76f85dcc54aa022baf8486c741a","id":"AC-01","recordedAt":"2026-10-05T02:00:06.046Z","status":"passed"}],"approvalId":"3fe25800-bb6f-4fbe-a1fa-5d944a5b3240","checks":[{"executionId":"d843e889-f6f7-414e-909b-4ed3ab1726bb","id":"output-contract","inputDigest":"2937bd7965e9a653df0ab9466f18881945dd86f6e4edb1ea3c84fdcd954d7ec1","moduleDigest":"32b51a1486ea078d8ec3941a52b0d6f7f2b8e6b095c702af60ce1c809ba58e87","observationDigest":"59c785c313be73fc6295557a90174e3962d40097eba25cf8968481a90a560a11","recordedAt":"2026-10-05T01:59:55.065Z","reusedFrom":null,"runtimeDigest":"55657bbee9475c45f1a323159edb5882baa6bb1b9baafc212f947879cad10f13","status":"passed","trustTier":"component-closed-input"}],"environmentFingerprint":"e576d498de36691019da4be51cc3588493132de2182cb6856270597d3187e65d","executionFingerprint":"d1e94dcf2fd55444960dafcfdc9d0e505b0fed6cf8910d0ae8f80f7e33a4645f","manifestDigest":"dbbc932127cc6c594feec69d5e7cc4b181e2632084643d547461ff530546051d","mode":"information-flow","modelDigest":"4a06d131db4a14e0b818901ab34ba497c3bddd1f39d7c79d48b7a26c8581738d","policyDigest":"dbbc932127cc6c594feec69d5e7cc4b181e2632084643d547461ff530546051d","sourceScope":"declared-component-inputs","specId":"spec-assurance-smoke"}